<?xml version="1.0" encoding="UTF-8"?>
<!-- edited with XMLSpy v2008 rel. 2 (http://www.altova.com) by mazuki (darksiderg) -->
<!--W3C Schema generated by XMLSpy v2008 rel. 2 (http://www.altova.com)-->
<xs:schema xmlns:xs="http://www.w3.org/2001/XMLSchema">
	<xs:element name="Rotors">
		<xs:complexType>
			<xs:sequence maxOccurs="unbounded">
				<xs:element ref="Rotor"/>
			</xs:sequence>
		</xs:complexType>
	</xs:element>
	<xs:element name="Rotor">
		<xs:complexType>
			<xs:sequence maxOccurs="unbounded">
				<xs:element ref="Mapping"/>
			</xs:sequence>
			<xs:attribute name="notch" type="xs:int" use="required"/>
			<xs:attribute name="id" type="xs:int" use="required"/>
		</xs:complexType>
	</xs:element>
	<xs:element name="Reflectors">
		<xs:complexType>
			<xs:sequence maxOccurs="5">
				<xs:element ref="Reflector"/>
			</xs:sequence>
		</xs:complexType>
	</xs:element>
	<xs:element name="Reflector">
		<xs:complexType>
			<xs:sequence maxOccurs="unbounded">
				<xs:element ref="Reflect"/>
			</xs:sequence>
			<xs:attribute name="id" use="required">
				<xs:simpleType>
					<xs:restriction base="xs:string">
						<xs:enumeration value="I"/>
						<xs:enumeration value="II"/>
						<xs:enumeration value="III"/>
						<xs:enumeration value="IV"/>
						<xs:enumeration value="V"/>
					</xs:restriction>
				</xs:simpleType>
			</xs:attribute>
		</xs:complexType>
	</xs:element>
	<xs:element name="Reflect">
		<xs:complexType>
			<xs:attribute name="input" type="xs:int" use="required"/>
			<xs:attribute name="output" type="xs:int" use="required"/>
		</xs:complexType>
	</xs:element>
	<xs:element name="Mapping">
		<xs:complexType>
			<xs:attribute name="left" type="xs:string" use="required"/>
			<xs:attribute name="right" type="xs:string" use="required"/>
		</xs:complexType>
	</xs:element>
	<xs:element name="Machine">
		<xs:complexType>
			<xs:sequence>
				<xs:element name="ABC" type="xs:string"/>
				<xs:element ref="Rotors"/>
				<xs:element ref="Reflectors"/>
			</xs:sequence>
			<xs:attribute name="rotors-count" type="xs:int" use="required"/>
		</xs:complexType>
	</xs:element>
	<xs:element name="Enigma">
		<xs:complexType>
			<xs:sequence>
				<xs:element ref="Machine"/>
				<xs:element ref="Decipher" minOccurs="0"/>
				<xs:element ref="Battlefield" minOccurs="0"/>
			</xs:sequence>
		</xs:complexType>
	</xs:element>
	<xs:element name="Dictionary">
		<xs:complexType>
			<xs:sequence>
				<xs:element name="Words" type="xs:string"/>
			</xs:sequence>
			<xs:attribute name="exclude-chars" type="xs:string" use="required"/>
		</xs:complexType>
	</xs:element>
	<xs:element name="Decipher">
		<xs:complexType>
			<xs:sequence>
				<xs:element ref="Dictionary"/>
			</xs:sequence>
			<xs:attribute name="agents" type="xs:int" use="required"/>
		</xs:complexType>
	</xs:element>
	<xs:element name="Battlefield">
		<xs:complexType>
			<xs:attribute name="rounds" type="xs:int" use="required"/>
			<xs:attribute name="level" use="required">
				<xs:simpleType>
					<xs:restriction base="xs:string">
						<xs:enumeration value="Easy"/>
						<xs:enumeration value="Medium"/>
						<xs:enumeration value="Hard"/>
						<xs:enumeration value="Insane"/>
					</xs:restriction>
				</xs:simpleType>
			</xs:attribute>
			<xs:attribute name="battle-name" type="xs:string" use="required"/>
			<xs:attribute name="allies" type="xs:int" use="required"/>
		</xs:complexType>
	</xs:element>
</xs:schema>
